{
  "schema": "flop-yellow-paper-baseline-v1",
  "artifact_generated_at": "2026-10-02T09:14:22Z",
  "reviewed_at": "2026-10-02T09:14:22Z",
  "source": {
    "source_id": "FLOP_YELLOW_PAPER",
    "url": "https://flop.finance/intro/yellowpaper/",
    "authority": "OFFICIAL_PARAMETER_VALUES",
    "version": "0.5.0 (draft)",
    "document_status": "Implementation spec — iterating",
    "updated": "2026-09-24",
    "raw_sha256_at_review": "67cee59db45c72f7dce991e18333c319d60890f5b48503125c3d4aa42251b01f",
    "normalized_text_sha256": "ac642abefeccd294e139256d2927234e35bb95efcf4431b59743c273207d6837",
    "semantic_commitment_sha256": "d09c703e19cd66ef1c7fbb3444e2a832e5820e193fb109c7c166d9fd6c7f1a49",
    "discovered_url_navigation": "INERT",
    "provenance": {
      "authority_state": "OFFICIAL_NORMATIVE_DRAFT",
      "spec_commit": "3c97bbc8d6ba68cf2ea003ab88bc154aafdf105e",
      "repository_url": "https://github.com/flop-labs/yellowpaper",
      "retrieved_at": "2026-10-02T09:14:22Z",
      "repository_content_sha256": "b09a36d8eca75324152f2084c0cb7b9d21987e12d857445933907a12b0b0c03b",
      "evidence_manifest": "data/official_baseline/2026-10-02/manifest.json",
      "semantic_diff": "PARAMETERS_UNCHANGED_WIRE_SPEC_UPDATED"
    }
  },
  "status": "OFFICIAL_DRAFT_REVIEWED",
  "parameters": {
    "genesis_supply": 4400000000,
    "genesis_miner_airdrop": 1200000000,
    "genesis_validator_airdrop": 1200000000,
    "genesis_agent_airdrop": 1200000000,
    "genesis_reserve": 800000000,
    "initial_block_reward": 96,
    "miner_share_ppt": 750,
    "validator_share_ppt": 100,
    "agent_share_ppt": 100,
    "staker_share_ppt": 50,
    "max_halvings": 5,
    "floor_reward": 3,
    "subsidy_per_block_per_recipient": 8
  },
  "semantic_diff_review": {
    "previous_reported_genesis_pool": 2483460000,
    "previous_validator_airdrop": 305505000,
    "classification": "SUPERSEDED_REPORTED_VALUES_NOT_CURRENT_AUTHORITY"
  },
  "unresolved": [
    "TESTNET_ENDPOINT",
    "FAUCET_ENDPOINT",
    "CLAIM_ENDPOINT",
    "REGISTRATION_OR_PROVISIONING_ENDPOINT",
    "TOKEN_OR_CONTRACT_ENDPOINT",
    "AGENT_SCORING_FORMULA",
    "TESTNET_TO_MAINNET_CONVERSION",
    "MINIMUM_ACTIVITY",
    "SNAPSHOT_DATE",
    "CLAIM_WINDOW",
    "AIRDROP_CAP_FORMULA",
    "SPEND_TO_UNLOCK_FINAL_RULE",
    "VESTING_RELEASE_RECONCILIATION",
    "UNALLOCATED_REMAINDER_DISPOSITION",
    "AGENT_STAKER_REWARD_DISTRIBUTION"
  ],
  "safety": {
    "ready_to_act": false,
    "authorized_to_act": false,
    "live_action_enabled": false,
    "production_authorities": 0,
    "external_writes": 0
  }
}
